numero,ano,ementa
1243,2001,Dispõe dispõe sobre a criação de cargo no quadro de pessoal do poder executivo municipal.
1244,2001,"Cria cria cargos de provimento efetivo na estrutura do poder executivo, e dá outras providencias."
1245,2001,"Denomina de Rodovia Suzan Cavell, a via pública de acesso às industrias neste município, no KM 12 da PE-60."
1246,2001,"Autoriza a contratação de Professores Alfabetizadores por prazo determinado, para atender a excepcional necessidade do serviço, e dá outras providências."
1247,2001,Dispõe sobre a abertura de Crédito suplementar e de providências correlatas.
1248,2001,Desafeta imóvel de domínio Público e dá outras providências.
1249,2001,"Autoriza autoriza o poder executivo, doar o imóvel que indica."
1250,2001,"Denomina de QUADRA DE ESPORTES OTÁVIO DA CUNHA FERREIRA, a Quadra Poliesportiva localizada na Praça Pedro Serafim de Souza, no Distrito de Camela, neste Município de Ipojuca."
1251,2001,"Denomina denomina de biblioteca pública municipal maria josé pinto, a biblioteca pública da praça afonso luiz soares, no distrito de camela, neste município de ipojuca."
1252,2001,"Denomina de PRAÇA TEREZINHA CAVALCANTI DE ALBUQUERQUE, a Praça localizada na Avenida Dr. Humberto da Costa Soares, em frente ao Colégio Min. Jarbas Passarinho, no Distrito de Camela, neste Município de Ipojuca."
1253,2001,"Denomina denomina de banda marcial maria josé ferreira de oliveira, a banda da escola ministro jarbas passarinho, no distrito de camela, neste município de ipojuca."
1254,2001,"Denomina denomina de biblioteca iranida albuquerque ramos, a biblioteca da escola municipal ministro jarbas passarinho, no distrito de camela, neste município de ipojuca."
1255,2001,Cria o Sistema Municipal de Ensino do Ipojuca e dá outras providências
1256,2001,Altera a composição do Conselho Municipal de Acompanhamento e Controle Social do Fundo de Manutenção e Desenvolvimento do Ensino Fundamental e de Valorização do Magistério.
1257,2001,"Autoriza o Pbcfer Executivo a declarar património municipal e imunes de corte as árvores consideradas de preservação necessária por sua localização, raridade, beleza ou condição de porta-sementes."
1258,2001,Autoriza alienação de bens inservíveis e dá outras providências.
1259,2001,Altera a composição do Conselho Municipal de Assistência Social - CMAS.
1260,2001,"Denomina denomina de estádio de futebol severino ramos dos reis, o estádio de futebol localizado no loteamento santo antónio, no distrito de camela, neste município de ipojuca."
1260,2001,Dispõe dispõe sobre abertura de~crédito suplementar e de providências correlatas v.
1261,2001,"Institui institui o programa de garantia de renda mínima vinculado à educação - bolsa escola, e determina outras providências."
1262,2001,Criação criação do conselho e fundo municipal dos direitos da pessoa portadora de deficiência.
1263,2001,Disciplina disciplina a concessão de incentivos fiscais aos agentes económicos e dá outras providências.
1264,2001,Dispõe sobre a isenção de taxas e impostos do Plano Arrendamento Residencial PAR.
1265,2003,Altera altera a composição do conselho municipal de promoção dos direitos da criança e do adolescente do município do ipojuca.
1266,2001,Cria cargos comissionados.
1267,2001,Dispõe dispõe sobre abertura de^rédito suplementar e de providências correlatas.
1269,2001,"Estabelece estabelece deveres e atribuições aos cargos de provimento efetivo e comislsionado criados pela lei n° 1236/2001, aumenta a quantidade de vagas dos cargos assessor parlamentar e dá outras providências."
1270,2001,Autoriza autoriza o município de ipojuca conceder a telecomunicações de pernambuco s/a telemar a permissão de uso de bem público e dá outras providências.
1271,2001,Dispõe dispõe sobre as direírizes para a elaboração da lei orçamentaria de 2002 e dá outras providências.
1272,2001,Dispõe dispõe sobre a criação de cargos de provimento em comissão no quadro de pessoal do poder executivo municipal.
1273,2001,"Implanta implanta o programa saúde da família psf no âmbito da administração municipal, e dá outras providências."
1274,2001,Dispõe dispõe sobre a criação de cargo no quadro de pessoal do poder executivo municipal.
1275,2001,Autoriza autoriza a cessão do direito de uso do imóvel que indica e dá outras providências.
1276,2001,Cria cria nome de vila situada no acesso principal à sede do município de ipojuca e dá outras providências.
1277,2001,Dispõe dispõe sobre o plano plurianual do município de ipojuca para o período 2002-2005 e dá outras providências.
1278,2001,Dispõe sobre abertura de Crédito Suplementar e de Providências correlatas.
1279,2001,Cria cria o conselho municipal de desenvolvimento sustentável - cmds.
1280,2001,"Implanta implanta o projeto agente jovem de desenvolvimento social e humano, no âmbito da administração municipal, e dá outras providências."
1281,2001,"Implanta implanta o programa sentinela - projeto resgate, no âmbito da administração municipal, e dá outras providências."
1282,2001,Cria cria nome de rua situada na sede do município de ipojuca e dá outras providências.
1283,2001,Institui institui na rede municipal de ensino a disciplina que trata da história do ipojuca e dá outras providências.
1283,2001,Denomina denomina praça euclides augusto dos santos à praça do convento.
1284,2001,Dispõe sobre a introdução do nome do Nome do Vereador em lei de sua autoria e dá outras providências.
1285,2001,"Dispõe dispõe sobre o plantio, extração, poda, substituição de árvores e dá outras providências."
1286,2001,"Cria o PLANO DE REGULAMENTAÇÃO DA ORLA DO MUNICÍPIO DO IPOJUCA PERNAMBUCO, definindo normas para uso e ocupação do solo na faixa litorânea do Município e Comissão de Análise de Projetos Especiais e/ou de impacto e dá outras providências."
1287,2001,Cria cria nome de praça localizada na sede do município de ipojuca e dá outras providências.
1288,2001,Dispõe dispõe sobre o atendimento de clientes e/ou usuários em estabelecimentos bancários no município de ipojuca.
1290,2001,"Denomina denomina avenida josé soares de medeiros, à via urbana que liga a av. gilvam leôncio marques à pe-60."
1291,2001,Autoriza a Contratação por Tempo Determinado de profissionais para atuarem no âmbito da administração pública municipal.
1293,2001,Cria cria nome de escola localizada na sede do município de ipojuca e dá outras providências.
1294,2001,"Denomina denomina de hospital santo cristo, o hospital localizado na sede do município de ipojuca."
1295,2001,Redefine redefine as divisas interdistritais do município e dá outras providências.
1296,2001,"Dá dá nova redação a dispositivos da lei n.° 1279, de 18 de outubro de 2001."
1297,2001,Vigilância Dispõe sobre a taxa de Sanitária e dá outras providências.
1298,2001,"Concede concede anistia parcial de débitos para a com a fazenda municipal, para débitos inscritos e passíveis de inscrição em dívida ativa e dá outras providências."
1299,2001,"Dispõe sobre a criação do Departamento de Defesa Social, e dá outras providências."
1300,2001,"Aumente a Verba de Gabinete, e dá outras providências."
1301,2001,"Dispõe dispõe sobre o aumento do número de cargos comissionados de assessor parlamentar, símbolo ap-1, na câmara municipal de ipojuca e dá outras providências."
1302,2001,Dispõe dispõe sobre o reajuste dos funcionários efetivos e comissionados da câmara municipal de ipojuca.
1304,2001,"Acrescenta acrescenta parágrafo único no artigo 2.° da lei n.° 1.263/01, e dá outras providências."
1305,2001,Institui institui regulamento e o disciplinamento das sanções aplicáveis aos atos ofensivos à limpeza urbana e dá outras providências.
1306,2002,Dispõe dispõe sobre a criação de abono provisório para os servidores estatutários ativos do quadro de pessoal do poder executivo municipal.
1307,2002,"Altera altera dispositivos da lei n.° 1158/98 de 30 de abril de 1998, que dispõe sobre o programa municipal de agentes comunitários de saúde pacs, sua estrutura e funcionamento, e dá outras providências."
1308,2002,"Autoriza autoriza a contratação temporária de pessoa! por excepcional interesse público para as funções que especifica, e dá outras providências."
1309,2002,Concede concede em caráter excepcional pensão especial temporária.
1310,2002,"Autoriza autoriza destinação de recursos, para direta ou indiretamente, cobrir necessidades de pessoas físicas."
1311,2002,Reajusta reajusta vencimentos de servidores públicos municipal que percebam retribuição inferior ao salário mínimo vigente no país.
1312,2002,"Dispõe dispõe sobre o regime próprio de previdência municipal, do município do ipojuca, do estado de pernambuco, de conformidade com a legislação federal e adota outras providências."
1313,2002,Designa designa ordenadores de despesas no âmbito do poder executivo municipal e dá outras providências.
1314,2002,Cria cria o conselho municipal do idoso e dá outras providências.
1315,2002,"Autoriza autoriza transferência de recursos ao setor privado à pessoas jurídicas que prestem serviço à população sem fins lucrativos, demonstrado o interesse público."
1316,2002,Institui institui horário para funcionamento dos estabelecimentos comerciais e dá outras providências.
1317,2002,Dispõe dispõe sobre a revisão do plano plurianual do município de ipojuca para o exercício de 2003 e dá outras providencias.
1318,2002,Estabelece estabelece as diretrizes orçamentarias do município de ipojuca para o exercício de 2003 e dá outras providências.
1319,2002,"Dispõe dispõe sobre a estrutura administrativa e organizacional da secretaria de saúde e bem estar social, altera a lei n.° 1234/2001 e dá outras providências,"
1320,2002,Cria cria nome de logradouro público localizado neste município do ipojuca e dá outras providências.
1321,2002,"Dispõe dispõe sobre obrigatoriedade do diagnóstico da audição dos bebés, imediatamente após o nascimento, nas maternidades e hospitais da rede municipal de saúde e, no máximo, até três meses de vida, dos bebés nascidos fora das maternidades e dá outras providências."
1322,2002,"Autoriza autoriza o poder executivo municipal a permutar bem imóvel de sua propriedade, por bem imóvel de propriedade do tribunal de justiça de pernambuco e dá outras providências."
1323,2002,Dispõe dispõe sobre a criação do conselho municipal de cultura e dá outras providências. (projeto de lei de autoria do vereador romero antónio raposo sales).
1324,2002,"Altera altera o anexo i da lei n.° 1315/2002, de 25 de junho de 2002."
1325,2002,Altera altera a redação de dispositivos da lei n.° 1312/2002.
1326,2002,Dispõe dispõe sobre a abertura de crédito especial e dá outras providências.
1327,2002,"Autoriza autoriza o poder executivo, doar os imóveis que indica."
1328,2002,Dispõe dispõe sobre a abertura de créditos suplementares ao orçamento do exercício de 2002.
1329,2002,Cria nome de ESCOLA localizada em Engenho neste Município do Ipojuca e dá outras providências.
1330,2002,"Cria nome de ESCOLA MODELO localizada no Loteamento Canoas no distrito de Nossa Senhora do Ó, neste Município do ipojuca e dá outras providências."
1331,2002,"Cria nome de PRAÇA localizada na praia de Porto de Galinhas, neste Município do Ipojuca e dá outras providências."
1332,2002,"Revoga revoga a lei n.° 1324/2002, de 21 de agosto de 2002 e altera o anexo l da lei n.° 1315/2002, de 25 de junho de 2002."
1333,2002,Cria cria a medalha jaime agostinho lins e dá outras providências.
1334,2002,"Autoriza autoriza o poder executivo municipal, a compensar a área da alameda existente entre os lotes 5-a e 6-a, por área correspondente a ser acrescida na alameda existente entre os lotes 6-a e 7-a da área denominada merepe b-2, em enseada do cupê, neste município e dá outras providências."
1335,2002,Cria o Trofeu JOSÉ GOMES DE VASCONCELOS e dá outras providências.
1336,2003,Estima a receita e fixa a despesa da Prefeitura do Ipojuca para o Exercício de 2003.
1337,2002,Dispõe dispõe sobre a destinação de subvenções sociais e auxílios ao setor privado e dá outras providências.
1338,2002,"Cria cria nome de rua localizada na praia de maracaípe, neste município do ipojuca, e dá outras providências."
1339,2002,"Cria cria nome de rua localizada na praia de maracaípe, neste município do ipojuca, e dá outras providências."
1340,2002,"Cria cria nome de rua localizada na praia de porto de galinhas, neste município do ipojuca, e dá outras providências."
1341,2002,Aletera a denominação da Praça Getúlio Vargas e dá outras providências.
1342,2002,Aumente aumente a verba de gabinete e dá outras providências.
1343,2002,"Introduz introduz modificações e inclusões nas normas urbanística da lei n.° 1286, de 14 de novembro de 2001."
1344,2002,"Aprova aprova o programa de enfrentamento à pobreza do conselho municipal de assistência social - cmas/departamento do bem estar social, e dá outras providências."
1345,2002,"Introduz introduz modificação na lei n° 733, de 24 de março de 1977 e alterações, dando outras providências."
1346,2003,"Dispõe sobre a criação de cargo comissionados, no âmbito da Secretaria de Educação, Cultura e Esportes."
1347,2003,Dispõe dispõe sobre a criação do cargo em comissão de procurador da câmara municipal de ipojuca e dá outras providências.
1348,2003,"Dispõe dispõe sobre o aumento do número de cargos comissionados de assessor parlamentar, símbolo ap-1, na câmara municipal de ipojuca e dá outras providências."
1349,2003,Autoriza autoriza o poder executivo municipal a destinar subvenções e auxílios ao setor privado e dá outras providências.
1350,2003,Dispõe dispõe sobre a criação de abono provisório para os servidores estatutários ativos do quadro de pessoal do poder executivo municipal e dá outras providências.
1351,2003,"Institui institui o plano de cargo, carreira e remuneração do magistério público municipal e dá outras providências."
1352,2003,Reajusta vencimentos de servidores públicos municipais que percebam retribuição inferior ao salário mínimo vigente no País.
1353,2003,Dispõe sobre o reajuste dos vencimentos dos funcionários comissionados da Câmara Municipal de Ipojuca.
1354,2003,Dispõe sobre o Conselho Municipal de. Promoção e Defesa dos Direitos da Criança e do Adolescente do município do Ipojuca e dá outra providencias.
1355,2003,"Dispõe dispõe sobre os conselhos tutelares do município do ipojuca, estabelece direitos e deveres dos seus membros e dá outras providências."
1356,2003,Dispõe sobre a criação do Fundo municipal de Promoção e Defesa dos Direitos da Criança e do Adolescente e dá outras providências.
1357,2003,"Altera altera dispositivos da lei n.° 1307/2002, de 31 de janeiro de 2002,. que dispõe sobre o programa municipal de agentes comunitários de saúde - pacs, sua estrutura e funcionamento, e dá outras providências."
1358,2003,"Altera altera o anexo l da lei municipal n.° 1349, de 25 de fevereiro de 2003."
1359,2003,"Altera altera o anexo l da lei municipal n.° 1349, de 25 de fevereiro de 2003."
1360,2003,"Altera o Anexo l da Lei Municipal n.° 1349, de 25 de fevereiro de 2003."
1361,2003,Institui institui o programa a caminho da escola e dá outras providências.
1362,2003,"Cria cria nome de rua localizada na praia de porto de galinhas, neste município do ipojuca e dá outras providências."
1364,2003,Lei lei das diretrizes orçamentárias - ldo.
1365,2003,"Dá dá nova redação e acrescenta dispositivos à lei n.° 1064, de 15 de junho de 1994."
1366,2003,Autoriza autoriza abertura de créditos suplementares e dá outras providências.
1367,2003,Estima estima a receita e fixa a despesa da prefeitura do ipojuca para o exercício 2004.
1368,2003,"Estima estima a receita e fixa a despesa da prefeitura do ipojuca, para o exercício de 2004."
1369,2003,"Modifica modifica e renumera a lei municipal n° 1.139/97, que cria o conselho municipal de assitência social cmas e dá outras providências."
1370,2003,Autoriza autoriza realização da jornada de dedicação exclusiva para professores contratados pela lei municipal 1.308/02 para atuação do peti programa de erradicação do trabalho infantil.
1371,2003,Modifica modifica a lei municipal n.° 1.312/02 e dá outras providencias.
1372,2003,Cria cria o fundo municipal de desenvolvimento sustentável e dá outras providencias.
1373,2003,Dispõe sobre o reajuste dos funcionários da Câmara Municipal de Ipojuca.
1374,2003,Dispõe dispõe sobre o aumento do número de cargos comissionados assessor parlamentar nível l - símbolo ap-i na estrutura da câmara municipal do ipojuca.
1375,2003,Aumenta aumenta a verba de gabinete e dá outras providências.
1376,2003,"Institui institui a contribuição para o custeio do serviço iluminação pública do município do ipojuca, prevista no artigo 149a da constituição federal e dá outras providências."
1377,2003,"Autoriza autoriza o poder executivo a usar parâmetros para determinação do valor venal de imóvel edificado ou não para efeito do lançamento do iptu do exercício 2004, e dá outras providencias."
1378,2003,Altera altera dispositivos da lei 1.181 de 30 de dezembro de 1998 e dá outras providências.
1380,2004,"Dispõe dispõe sobre o plano de cargos e salários da administração direta do poder executivo do município do ipojuca - pe, estabelece normas gerais de enquadramento e dá outras providências."
1381,2004,"Dispõe dispõe sobre o plano de cargos e salários dos servidores efetivos da administração direta do poder executivo do município do ipojuca - f pe, estabelece normas gerais de enquadramento e dá outras providências."
1382,2004,"Altera altera o anexo l da lei municipal n° 1349, de 25 de fevereiro de 2003."
1383,2004,"Cria cria cargos de provimento efetivo na estrutura organizacional do poder executivo, e dá outras providências."
1384,2004,"Cria cargos de provimento em comissão na estrutura do Poder Executivo, e dá outras providências."
1385,2004,"Acrescenta acrescenta o parágrafo único ao artigo 2° e revoga o artigo 3°, da lei 1240/2001 , e dá outras providências."
1386,2004,"Cria duas vagas no quadro de Assessores Jurídicos - Símbolo CC-IV da Prefeitura Municipal do Ipojuca, para atuação na Assessoria Jurídica do Município à disposição do Poder Judiciário."
1387,2004,Altera altera os arts. 8° e 9° da lei n° 1.367 de 02 dezembro de 2003 que autoriza abertura de créditos suplementares e dá outras providências.
1388,2004,"Altera dispositivos da Lei 1351/03 que dispõe sobre o Plano de Cargos, Carreiras e Remuneração do Magistério Público Municipal e dá outras providências."
1389,2004,"Autoriza autoriza a contratação temporária de pessoal por excepcional interesse público para as funções que especifica, e dá outras providências."
1390,2004,"Autoriza o Poder Executivo, a regularizar por terceiros, de lotes de terrenos nos Loteamentos Canoas, Santo António e António Dourado Neto e dá outras providências."
1392,2004,"Cria cria nome de rua localizada na praia de serrarnbi, neste município providências,"
1394,2004,Dispõe dispõe sobre a revisão do plano plurianual do município do ipojuca para o exercício de 2005 e dá outras providências.
1395,2004,Estabelece estabelece as diretrizes orçamentarias do município de ipojuca para o exercício de 2005 e dá outras providências.
1396,2004,"Dispõe sobre a estrutura organizacional, reformulação do quadro de pessoal da Câmara Municipal de Ipojuca-PE, estabelecimento de deveres e atribuições, criação de cargos e dá outras providências."
1397,2004,"Altera a redação do inciso IV, do artigo 69, da Lei n° 1393, de 21 de maio de 2004 e dá outras providências."
1398,2004,"Denomina denomina nome de praça localizada às margens da rua manoel gomes e outras no loteamento canoas no distrito de nossa senhora do ó, neste município do ipojuca e dá outras providências."
1399,2004,"Cria cria nome de logradouro público localizado no distrito de nossa senhora do ó, neste município do ipojuca, e dá outras providências."
1400,2004,Dispõe dispõe sobre a estrutura do poder executivo do município do ipojuca e dá outras providências.
1402,2004,"Fixa fixa o subsídio do prefeito, do vice-prefeito e dos secretários municipais do município de ipojuca a viger a partir de 1° de janeiro de 2005."
1403,2004,Fixa fixa o subsídio dos vereadores do município de ipojuca para a legislatura 2005/2008.
1404,2005,Altera altera o anexo iii da lei n° 1396/2004 e dá outras providências.
1406,2005,"Dá o nome de ESCOLA MODELO EXPREFEITO JAIME AGOSTINHO LINS, à Escola Municipal localizada na 1a Travessa do Colégio Aderbal Jurema, nesta cidade de Ipojuca, e dá outras providências."
1407,2005,Regulamenta regulamenta e estabelece valor para concessão de diárias aos vereadores e servidores da câmara municipal de ipojuca-pe e dá outras providências.
1408,2005,"Cria nome de RUA localizada no Distrito de Nossa Senhora do Ó, neste Município de Ipojuca, e dá outras providências."
1409,2005,Dispõe sobre a criação de programas sociais e dá outras providências.
1410,2005,"Institui o Percentual do Adicional Noturno para os Servidores do Município, fixa a hora de trabalho noturna, e os procedimentos de apuração e pagamento do Adicional Noturno."
1411,2005,Reajusta a Verba de Gabinete e dá outras providências.
1412,2005,Disciplina a concessão de incentivos fiscais aos agentes económicos e dá outras providências.
1413,2005,"Modifica modifica os deveres e atribuições dos cargos de provimento em comissão constantes do anexo iv - tabela ""b"" da lei n° 1396/2004 e da lei 1404/2005 e dá outras providências."
1414,2005,Cria cria cargos comissionados no âmbito da procuradoria geral do município e dá outras providências.
1415,2005,"Altera altera o anexo único da lei n° l .409, de 30 de março de 2005 e dá outras providencias."
1416,2005,Dispõe dispõe sobre o plano plurianual - ppa para o quadriénio 2006-2009 e dá outras providências.
1417,2005,Estabelece as diretrízes orçamentarias do Município do Ipojuca para o exercício de 2006 e dá outras providências.
1418,2005,Altera altera o artigo 10 da lei n° 1.381/2004 e dá outras providências.
1419,2005,Autoriza autoriza a cessão de direito decorrente das leis n° 1.162/98 e 1.202/99 e dá outras providências.
1420,2005,"Institui institui no calendário oficial de eventos do município do ipojuca, no dia 14 de outubro, louvação ao dia do evangélico e dá outras providencias."
1422,2006,Institui institui a verba indenizatória do exercício parlamentar da câmara municipal do ipojuca e dá outras providências.
1423,2006,Altera altera o anexo - 1 da lei n° 1 .404/2005 e dá outras providências.
1424,2006,"Modifica modifica o anexo único da lei 1414/2005, criando 8 (oito) cargos de superintendente de serviços."
1425,2006,"Reajusta reajusta os valores nominais do vencimento base dos servidores públicos, a remuneração dos cargos em comissão, o vencimento dos contratados por prazo determinado, e dá outras providências."
1426,2006,"Equipara equipara os vencimentos dos professores contratados temporariamente aos professores efetivos, cria símbolo e vencimento específico para os agentes de segurança escolar e dá nova redação ao §2° do artigo 11 da lei 1400/2004."
1427,2006,Altera altera o artigo 20 da lei 1.355/2003 atualizando os parâmetros de remuneração dos conselheiros tutelares de acordo com a tabela constante da lei n° 1.400/2004 e atualizações posteriores.
1428,2006,Acrescenta acrescenta parágrafo único ao artigo 4° da lei 1.133/1997 e regulamenta a cessão dos representantes do sindicato dos servidores do município do ipojuca.
1429,2006,Autoriza autoriza o poder executivo a doar imóvel para o cefet-pe centro federal de educação tecnológica de pernambuco e revoga a autorização para a cessão de direito decorrente da lei n° 1419/2005.
1430,2006,"Altera o art. 3° da Lei 1.281/2001, o inciso II do art. 3° da Lei 1.307/2002 e os Anexos II e III da Lei n° 1.400/2004, cria cargos comissionados e dá outras providências."
1431,2006,"Cria cargos em Comissão no âmbito das Secretarias de Infra-Estrutura e de Desenvolvimento Económico, Urbanismo e Turismo."
1432,2006,"Altera altera os artigos 149, 150 e 151 da lei 1.181 de 30 de dezembro de 1998 - código tributário do município e dá outras providências."
1433,2006,Incentiva incentiva a quitação e o parcelamento especial de créditos junto ao município do ipojuca.
1434,2006,"Autoriza o Poder Executivo a abrir crédito suplementar ao Orçamento Fiscal do Município de Ipojuca, relativo ao exercício de 2006 e dá outras providências."
1435,2006,Altera altera o anexo - 1 da lei n° 1.423/2005 e dá outras providências.
1436,2006,Cria cria o conselho municipal de defesa dos direitos humanos e dá outras providencias.
1437,2006,Modifica o artigo 4° da Lei 1337/2002 e dá outras providencias.
1438,2006,"Institui institui sistema de credenciamento de veículos automotores para a prestação de serviços aos órgãos e entidades do poder executivo municipal, estabelece parâmetros e tabela de remuneração dos serviços, e dá outras providências."
1439,2006,Cria a Guarda Municipal do Ipojuca e dá outras providências.
