numero,ano,ementa
1440,2006,Autoriza autoriza o poder executivo a contratar servidores através de contratos por tempo determinado para as funções que especifica e dá outras providências.
1441,2006,"Abre Crédito Suplementar ao Orçamento Fiscal do Município, relativo ao exercício de 2006, e dá outras providências."
1442,2006,"Reestrutura reestrutura o regime próprio de previdência social do município do ipojuca, do estado de pernambuco, instituído pela lei municipal n. 1.393, de 21 de maio de 2004, e dá outras providências."
1443,2006,"Abre crédito suplementar ao Orçamento fiscal do Município, relativo ao exercício de 2006, e dá outras providências."
1444,2006,"Abre abre crédito suplementar ao orçamento fiscal do município de ipojuca, relativo ao exercício de 2006 e dá outras providências."
1445,2006,Estabelece as diretrizes orçamentarias do Município do Ipojuca para o exercício de 2007 e dá outras providências.
1446,2006,Dispõe dispõe sobre a revisão do plano plurianual do município do ipojuca para o exercício de 2007 e dá outras providências.
1447,2006,"Dispõe sobre a aplicação de penalidades à prática de ""assédio moral"" nas dependências da Administração Pública Municipal Direta e Indireta por servidores públicos municipais."
1448,2006,"Autoriza o pagamento de gratificação mensal de R$ 700,00 (setecentos reais) para servidores do Poder Executivo integrantes do Grupo de Trabalho para acompanhamento da elaboração do Plano Diretor do Município do Ipojuca."
1449,2006,Lei lei de diretrizes orçamentárias - 2009.
1449,2006,"Autoriza o Poder Executivo a abrir crédito suplementar ao Orçamento Fiscal do Município de Ipojuca, relativo ao exercício de 2006 e dá outras providências."
1450,2006,"Autoriza o Poder Executivo a abrir crédito suplementar ao Orçamento Fiscal do Município de Ipojuca, relativo ao exercício de 2006 e dá outras providências."
1451,2006,Estima estima a receita e fixa a despesa da prefeitura do ipojuca para o exercício de 2007.
1452,2006,"Cria cria o programa municipal de incentivo à prática do esporte surf, e dá outras providencias."
1453,2006,"Modifica os Anexos I e III da Lei 1396/2004, cria os cargos de Secretário Administrativo e Secretário Administrativo Adjunto e dá outras providências."
1454,2006,Reduz o Valor da Verba Indenizatória do Exercício Parlamentar da Câmara Municipal do Ipojuca.
1455,2006,?
1456,2006,"Abre o orçamento fiscal do exercício 2006, autoriza a celebração de convénio com o Centro Federal de Ensino Tecnológico de Pernambuco para realização de despesas com terraplanagem no terreno doado pela Prefeitura do Município do Ipojuca."
1457,2007,"Cria nome da Avenida que se inicia na Praça Getúlio Vargas até a PE-60, nesta cidade de Ipojuca, e dá outras providências."
1458,2007,Altera o Anexo - l da Lei n° 1.396/2004 e dá outras providências.
1459,2007,Institui o Auxilio Alimentação no âmbito da Câmara Municipal de Ipojuca.
1460,2007,Autoriza autoriza o poder executivo a abrir crédito suplementar ao orçamento fiscal do exercício de 2007 do município o ípojuca.
1461,2007,Altera altera o anexo - l da lei n° 1.400/2004 e dá outras providências.
1462,2007,Dispõe dispõe sobre a abertura de crédito suplementar e dá outras providências.
1463,2007,"Dá dá o nome de avenida dona maria do carmo pontual de petribú, a avenida projetada existente no loteamento marina do rio aquirá, na praia de toquinho."
1464,2007,"Dá o nome de Rua Marcos Pontual de Petribú a Rua projetada existente no Loteamento Marina do Rio Aquirá, na Praia de Toquinho."
1465,2007,"Dá dá o nome de praça engenheiro pedro pessoa cavalcanti de petribú a praça existente no loteamento marina do rio aquirá, na praia de toquinho."
1466,2007,"Reajusta reajusta os valores nominais do vencimento base dos servidores públicos, a remuneração dos cargos em comissão, o vencimento dos contratados por prazo determinado, e dá outras providências."
1467,2007,"Cria cria a secretaria de turismo, esportes e cultura, modifica a lei 1400/2004 e dá outras providências."
1468,2007,Cria cria a coordenadoria municipal de defesa civil (comdec) do município do ipojuca e dá outras providências.
1469,2007,Dispõe dispõe sobre a criação do conselho municipal acompanhamento e controle social do fundo de manutenção e desenvolvimento da educação básica e de valorização dos profissionais da educação - conselho do fundeb.
1470,2007,"Dá dá o nome de escola municipal luiz manoel nogueira à escola (em construção) localizada na avenida dr. humberto da costa soares, no distrito de camela, e dá outras providências."
1471,2007,"Autoriza autoriza o chefe do poder executivo municipal a permutar área que especifica na praia de maracaípe distrito de nossa senhora do ó, e da outras providências."
1472,2007,Concede concede incentivos fiscais à empresa estaleiro atlântico sul s/a na forma da lei 1412/2005 e dá outras providências.
1473,2007,Prorroga prorroga o prazo de que trata o artigo 1° da lei 1429/2006.
1474,2007,Altera altera o anexo - l da lei n° 1.400/2004 e dá outras providências.
1475,2007,"Altera altera a estrutura organizacional da câmara, cria cargos de provimento efetivo, modifica as atribuições e dá outras providências."
1476,2007,Dispõe dispõe sobre a revisão do plano plurianual do município do ipojuca para o exercício de 2008 e dá outras providências.
1477,2007,Estabelece estabelece as diretrizes orçamentarias do município do ipojuca para o exercício de 2008 e dá outras providências.
1478,2007,"Concede concede incentivos fiscais à empresa terminal químico de aratil s/a tequimar na forma da lei 1.412/200,6 e dá outras proviências."
1479,2007,Concede concede incentivos fiscais à empresa m&g polímeros brasil s/a na forma da lei 1.412/2006 e dá outras proviências.
1480,2007,Altera altera o anexo - l da lei n° 1.400/2004 e dá outras providências.
1481,2007,Autoriza autoriza o poder executivo municipal a vender e ou permutar bens imóveis nas áreas públicas que especifica e dá outras providencias.
1482,2007,Dispõe dispõe sobre abertura de crédito suplementar e dá outras providências.
1484,2008,"Cria cria cargos no âmbito da administração direta, na área da saúde; altera dispositivos da lei municipal n° 1430/2006; a lei municipal 1.307/2002, que cria o programa de agentes comunitários de saúde; e possibilita as incorporações de servidores temporários na forma do parágrafo único do art. 2° da emenda constitucional n.° 51, de 14 de fevereiro de 2006."
1485,2008,"Reajusta reajusta os valores nominais do vencimento dos servidores públicos, dos cargos em comissão, e dos contratados por prazo determinado e dá outras providências."
1486,2008,"Dispõe dispõe sobre o reajuste dos funcionários comissionados, efetivos, aposentados e pensionistas da câmara municipal de ipojuca."
1487,2008,Altera altera a lei 1.442 de 04 de setembro de 2006 e dá outras providências.
1488,2008,"Modifica modifica o art. 7°, inciso i da lei 1483/2007 e dá outras providências."
1489,2008,"Desafeta desafeta do domínio público os bens cuja permuta ou alienação foram autorizados nas leis 1.471/2007 e 1.481/2007, e dá outras providências."
1490,2008,Aprova o Plano Diretor Participativo do Município e Dispõe sobre as condições de sua implementação no território municipal.
1491,2008,"Desafeta desafeta parte de praça pública que menciona, visando sua destinação a cessão de uso para construção de centro de treinamento e uma |nstjtujção de ensino superior."
1492,2008,Cria cria no âmbito municipal o programa bolsa família (pbf).
1493,2008,Revisa revisa o valor da verba indenizatória do exercício parlamentar.
1494,2008,Dispõe dispõe sobre o estatuto dos servidores públicos do município do ipojuca e dá outras providências.
1495,2008,"Autoriza autoriza o poder executivo a doar, com encargos, imóvel para a união federal e dá outras providências."
1496,2008,"Autoriza autoriza o poder executivo a doar, com encargos, imóvel para o tribunal regional do trabalho da 6a região e dá outras providências."
1497,2008,"Autoriza autoriza o poder executivo a doar, com encargos, imóvel para o tribunal de justiça do estado de pernambuco e dá outras providências."
1498,2008,Institui institui o código de obras e instalações do município do ipojuca e dispõe sobre sua aplicação no território municipal.
1500,2008,"Declara declara ç baoba(adasonia digitata), árvore-símbolo do município do ipojuca e dá outras providências."
1501,2008,Dispõe dispõe sobre a abertura de crédito suplementar e dá outras providências.
1502,2008,"Disciplina a concessão de incentivos fiscais para implantação, ampliação, modernização ou diversificação de refinaria de petróleo."
1503,2008,"Doa doa terreno urbano com área de 10-ooom2 para construção da nova sede do podre legislativo ipojucano, e dá outras providencias."
1504,2008,Concede concede incentivos fiscais à empresa companhia petroquímica de pernambuco petroquimicasuape na forma da lei 1.412/2005 e dá outras providências.
1505,2008,"Aprova aprova parâmetros de uso e ocupação do solo para a zona de interesse turístico zit-c do município de ipojuca, definidos em estudo específico nos termos do art. 172, parágrafo único, da lei municipal n° 1492/2008."
1508,2008,Fixa fixa o subsídio dos vereadores do município do ipojuca para a legislatura 2009/2012.
1509,2008,"Fixa fixa o subsídio do prefeito, do vice-prefeito e dos secretários e secretários-adj untos municipais do município de ipojuca a viger a partir de 1° de janeiro de 2009."
1510,2008,Reestrutura reestrutura a administração do regime próprio de previdência social do município do ipojuca - funprei.
1512,2008,Cria cria o fundo municipal de habitação de interesse social - fmhis e institui o conselho gestor do fmhis.
1513,2008,"Cria cria secretaria municipal de segurança cidadã, e dá outras providências."
1514,2008,Cria cria cargos de provimento efetivo no âmbito do poder executivo municipal e dá outras providências.
1515,2009,Disciplina a permissão de serviços de transporte público de passageiros por táxis no âmbito do município de ipojuca e dá outras providências.
1516,2009,Regulamenta e estabelece valor para concessão de diárias aos Vereadores e Servidores da Câmara Municipal de Ipojuca - PE e dá outras providências.
1517,2009,"Dispõe sobre a reestruturação organizacional da Câmara Municipal de Ipojuca, extingue os cargos de provimento em comissão que indica e dá outras providências."
1518,2009,Dispõe sobre a estruturação da Procuradoria da Câmara Municipal de Ipojuca e dá outras providências.
1519,2009,"Dispõe sobre a instituição do Sistema de Controle Interno - SCI do Poder Legislativo Municipal, cria o Órgão Central do SCI e dá outras providências."
1520,2009,"Autoriza autoriza o poder executivo a criar a empresa pública denominada agência de desenvolvimento econômico do ipojuca - ad. ipojuca, ajusta o plano plurianual (2006-2009) do município, autoriza a abertura de crédito adicional especial ao orçamento vigente e dá outras providências."
1521,2009,"Altera o artigo 2° da Lei Municipal n°. 1.459, de 24 de abril de 2007, que instituiu o Auxílio Alimentação no âmbito da Câmara Municipal de Ipojuca e dá outras providências."
1522,2009,"Dispõe sobre a criação do Sistema de Controle Interno Municipal, cria a Controladoria Geral do Município - CGM, ajusta o Plano Plurianua! do Município 2006-2009, abre Crédito Adicionai Especial ao Orçamento Vigente e dá outras providências."
1523,2009,"Altera a estrutura organizacional da Câmara Municipal de Ipojuca, extingue verba indenizatória dos Vereadores e dá outras providências."
1524,2009,"Cria nome de RUA do Loteamento Canoas no Distrito de Nossa Senhora do Ó, neste Município do Ipojuca, e dá outras providências."
1525,2009,"Altera o art. 1° da Lei n° 1.405, de 26 de janeiro de 2005, que dispõe sobre a criação de gratificação para membros da Comissão de Licitação da Câmara Municipal e dá outras providências."
1526,2009,"Dispõe dispõe sobre a inclusão de projetos no plano plurianual - ppa 2006-2009 - revisão do exercício de 2009, autoriza abertura de crédito adicional especial ao orçamento e dá outras providências."
1527,2009,"Autoriza o Poder Executivo a abrir crédito especial ao Orçamento Fiscal do Município de Ipojuca, relativo ao exercício de 2009 e dá outras providências."
1528,2009,"Altera altera dispositivo da lei municipal n° 1.181, de 30 de dezembro de 1998 e dá outras providências."
1529,2009,"Concede concede a remissão total dos créditos tributários não liquidados, referentes ao imposto predial e territorial urbano - iptu relativos aos imóveis de valor venal de até r$ 15.000,00 (quinze mil reais), para os exercícios de 2007 e 2008."
1530,2009,"Institui as gratificações de pregoeiro, equipe de apoio e de membros de comissões permanentes e especiais de licitação, no âmbito da administração direta do Poder Executivo Municipal, e dá outras providências."
1531,2009,Dispõe dispõe sobre a abertura de crédito suplementar e dá outras providências.
1532,2009,Institui institui o dia municipal da família no município do ipojucape.
1533,2009,Estabelece estabelece as diretrizes orçamentarias do município do ipojuca para o exercício de 2010 e dá outras providências.
1534,2009,Altera dispositivos da Lei n° 1.137 e de 06 de junho de 1997 e dá outras providências.
1535,2009,Dispõe sobre a criação do Conselho Municipal de Segurança do Ipojuca - COMUSI.
1536,2009,"Altera a Lei Municipal n°. 871 de 22 de novembro de 1985, que cria o Conselho Municipal de Educação de Ipojuca e dá outras providências."
1537,2009,Denomina 'Conjunto Habitacional Miguel Arraes de Alencar1 o conjunto habitacional a ser implantado no Distrito de Camela.
1538,2009,"Denomina ""denomina o complexo educacional desportivo do ipojuca a ser implantado no município."
1540,2009,"Institui institui o ""prêmio consciência ecológica"" às empresas e entidades não governamentais no município do ipojuca e dá outras providências."
1541,2009,"Denomina 'PRAÇA DE EVENTOS SILVINO ALVES DA SILVA FILHO' a Praça que será construída no Distrito de Nossa Senhora do Ó, neste Município."
1542,2009,"Colocação colocação das bandeiras de ipojuca, de pernambuco e do brasil em prédios públicos municipais."
1543,2009,"Institui institui o ""dia do fisco municipal do ipojuca"" e dá outras providências."
1544,2009,"Fixa fixa o salário base para o cargo específico de médico plantonista, servidor da administração pública municipal, e dá outras providências."
1545,2009,"Fixa fixa prazo para a realização de consultas médicas e exames de saúde pela rede pública, para pacientes com idade igual ou superior a sessenta anos, conforme especifica."
1546,2009,"Cria cria reserva de vagas de estacionamento exclusivas para idosos, deficientes físicos e gestantes no município de ipojuca e dá outras providências."
1547,2009,Dispõe dispõe sobre a isenção do pagamento de taxas de inscrição em concursos públicos da administração municipal e câmara dos vereadores no município de ipojuca e dá outras providências.
1548,2009,Autoriza autoriza o poder executivo a ceder sinal de internet gratuito à população e dá outras providências.
1549,2009,Altera altera a redação do inciso ii do art. 3° e inciso l do art. 11 da lei municipal n° 1.314/2002 e dá outras providências.
1550,2010,"Altera altera as disposições que nomeia, da lei n° 1.472, de 11 de setembro de 2007, que concede incentivos fiscais à empresa estaleiro atlântico sul s/a. e dá outras providências."
1551,2010,"Altera altera o inciso l do § 6° do art 27 da lei n° 1.181/98, revoga o inciso ii do § 6° do mesmo artigo, insere os parágrafos 8° e 9° no art. 27 e dá outras providências."
1552,2010,Dispõe sobre o Piano Plurianual - PPA para o quadriênio 2010-2013 e dá outras providências.
1553,2010,Lei Orçamentária Anual - 2010
1554,2010,Institui institui o código de vigilância sanitária em saúde e dá outras providências.
1555,2010,Institui institui o fundo municipal de assistência à pessoa idosa e dá outras providências.
1556,2010,Cria cria o cargo de gestor de investimentos do fundo previdenciário do município de ipojuca funprei e dá outras providências.
1557,2010,Reajusta reajusta os vencimentos dos médicos plantonlstas do poder executivo municipal e da outras providencias.
1558,2010,"Reajusta reajusta o vencimento dos servidores efetivos do poder executivo municipal, inativos e pensionistas vinculados ao funprei - fundo previdenciário dos servidores do município do ipojuca e dá outras providencias."
1559,2010,Estabelece o reajuste da remuneração dos servidores integrantes de cargos efetivos do quadro permanente de pessoal da Câmara Municipal do Ipojuca e dá outras providências
1560,2010,"Fixa gratificação para componentes da Comissão Permanente de Licitação do Fundo Previdenciário do Município do Ipojuca, e da outras providências."
1561,2010,Altera a alíquota da contribuição patronal ao Regime Próprio da Previdência dos Servidores Municipais de que trata a Lei Municipal n° 1442/2006 e dá outras providências.
1562,2010,"Revoga o § 2° e altera o caput do art. 2° da Lei n.° 1487, de 20 de março de 2008, bem como altera o § 3° do art. 56 da Lei n.° 1.442, de 04 de setembro de 2006, com redação da Lei n.° 1.487, de 20 de março de 2008 e da outras providencias."
1563,2010,"Concede incentivos fiscais à empresa COMPANHIA INTEGRADA TÊXTIL DE PERNAMBUCO - CITEPE, na forma da Lei 1.412/2005 e dá outras providências."
1564,2010,"Reajusta reajusta o vencimento dos servidores efetivos do poder executivo municipal, inativo e pensionistas, vinculados ao funprei - fundo previdenciário dos servidores do município do ipojuca e dá outras providências."
1565,2010,"Altera altera a redação do inciso ii, art. 3°, da lei municipal 1314/2002 e dá outras providencias."
1566,2010,Dispõe sobre a instituição de Plano de Amortização para Equacionamento do Passivo Atuarial do Fundo Previdênciário do Município do Ipojuca - FUNPREI e dá outras providências.
1567,2010,"Dispõe dispõe sobre ò""lonselho municipal de alimentação escolar - cae - e altera a lei municipal n° 1.150, de 08 de dezembro de 1997."
1568,2010,"Fixa o vencimento base para o cargo específico de procurador judicial, servidor efetivo da Administração Pública Municipal, e dá outras providências."
1569,2010,?
1570,2010,Lei das Diretrizes Orçamentárias - 2011
1571,2010,"Altera o § 1° e o capufdo art. 227 da Lei municipal n° 1.494, de 16 de julho de 2008, que ""Dispõe sobre o Estatuto dos Servidores Públicos do Município do Ipojuca"" e dá outras providências."
1572,2010,"Disciplina disciplina a obrigatoriedade e a utilização dos documentos fiscais ""declaração mensal de serviços oms""; da ""nota fiscal de serviços eletrônica - nfs-e"" e do ""recibo provisório de serviços - rps"" e dá outras providências."
1573,2010,Cria 02 (dois) cargos de Procurador Judicial junto à Procuradoria Geral do Município e dá outras provideências.
1574,2010,Dispõe sobre autorização para doação de terreno da municipalidade para o Instituto Nacional do Seguro Social - INSS e dá outras providências.
1575,2010,"Dispõe dispõe sobre s regulamentação para a concessão de utilidade pública municipal a sociedades civis, associações, fundações e outras entidades do terceiro setor e dá outras providencias."
1576,2010,Altera altera a lei n° 1.515/2000 disciplina a permissão de serviço de transporte público de passageiros por táxis no âmbito do município do ipojuca e dá outras providências.
1577,2010,"Altera altera a lei n° 1.513/2008, que criou a secretaria municipal de segurança cidadã e dá outras providências."
1578,2010,"Concede concede incentivos fiscais à empresa suata - serviço unificado de armazenagem e terminal alfandegado s/a, na forma da lei n° 1.412/2005 e dá outras providências."
1579,2010,Dispõe dispõe sobre o regime jurídico do sistema de transportes municipal do ipojuca e determina outras providências.
1580,2010,"Dispõe dispõe sobre alterações nos artigos 71, 72 e 253 da lei n° 1.490/2008 (plano diretor participativo) e dá outras providências."
1581,2010,"Altera altera a lei n° 1.490/2008 (plano diretor), fixando novos perímetros das zonas de atividade industrial e logística (zail b) e de equilíbrio ambiental (zea), descritas no anexo xii da lei em epígrafe."
1582,2010,Dispõe dispõe sobre a revisão do plano plurianual do município do ipojuca para o exercício de 2011 e dá outras providências.
1584,2011,Reajusta reajusta o vencimento base dos servidores da câmara municipal de ipojuca e dá outras providências.
1585,2011,"Aprova aprova o plano municipal de educação, e dá outras providências."
1586,2011,Dispõe dispõe sobre a concessão de diárias aos servidores e vereadores da câmara municipal do ipojuca e dá outras providências.
1587,2011,"Altera dispositivos da Lei nº 1.523/2009, que trata da estrutura organizacional da Câmara Municipal de Ipojuca e dá outras providências."
1588,2011,"Autoriza o Poder Executivo a celebrar Convênio de Cooperação com o Estado de Pernambuco, para gestão associada dos serviços públicos de abastecimento de água e esgotamento sanitário, e a celebrar Contrato de Programa com a Companhia Pernambucana de Saneamento COMPESA e dá outras providências."
1589,2011,"Revoga as Leis 1.495/2008, 1.496/2008, 1.497/2008 e dispõe sobre a doação, com encargos, de lotes de terreno resultantes do desmembramento da Gleba C do Engenho Montevidéu, ao Instituto Nacional da Seguridade Social, Caixa Econômica Federal, Tribunal Regional do Trabalho da 6- Região, União Federal, Tribunal de Justiça de Pernambuco."
1590,2011,"Revoga revoga a lei nº 1.503/2008 e dispõe sobre a destinação do lote d, resultante do desmembramento da gleba c do engenho montevidéu, desapropriada por força do decreto municipal nº 31/2007 ao poder legislativo do município do ipojuca."
1591,2011,?
1592,2011,Institui o Programa de Recuperação Fiscal Municipal REFIS/lpojuca e dá outras providências.
1593,2011,"Autoriza autoriza o poder executivo a desafetar, permutar e afetar bens que especifica visando à implantação de novo empreendimento turístico da empresa enotel hotels e resorts s/a. e dá outras providências."
1594,2011,?
1595,2011,Institui o Código de Posturas do Município de Ipojuca e dá outras providências.
1596,2011,Institui institui o código do meio ambiente do município do ipojuca e dá outras providências.
1597,2011,Institui institui o sistema municipal do meio ambiente do município do ipojuca.
1598,2011,Dispõe sobre a reestruturação da Secretaria Municipal de Agricultura e Produção Rural e dá outras providências.
1599,2011,Cria Cargos Comissionados no âmbito da Secretaria Municipal de Saúde
1600,2011,Estabelece normas para a prévia inspeção de animais destinados ao abate para o consumo e dá outras providências.
1601,2011,Cria cria cargos de provimento efetivo no âmbito do poder executivo municipal e dá outras providências.
1602,2011,Autoriza autoriza a câmara municipal do ipojuca a celebrar convênios com instituições financeiras para a concessão de operações de empréstimos sob consignação em folha de pagamento e dá outras providências.
1603,2011,"Dispõe sobre reajuste dos vencimentos dos professores da rede Municipal do Ipojuca em atendimento à Lei Federal nº 11.738, de 16 de julho de 2008 e dá outras providências."
1604,2011,"Institui o ""Dia Municipal do Surfista"" e dá outras providências."
1605,2011,"Institui o ""Dia Municipal do Jangadeiro"" e dá outras providências."
1606,2011,"Autoriza autoriza o poder executivo municipal a ceder em comodato ou direito real de uso de imóvel em favor do senai e do senac, para instalação de escolas técnicas profissionalizantes e dá outras providências."
1607,2011,"Prorroga prorroga o programa de recuperação fiscal municipal refis/lpojuca, introduz modificações na lei n° 1.592/2011 e dá outras providências."
1608,2011,Dispõe dispõe sobre a criação do arquivo público municipal frei vertendo willeke e dá outras providências.
1609,2011,?
1610,2011,"Complementa complementa o anexo v do plano diretor (lei n° 1.490/2008), fixando os coeficientes básicos e máximos e as condições para outorga onerosa do direito de construir e dá outras providências."
1611,2011,Institui institui o dia municipal do agricultor familiar do município de ipojuca e dá outras providências.
1612,2011,Institui institui o auxílio-saúde no âmbito da câmara municipal do ipojuca e dá outras providências.
1613,2011,"Altera a Lei n° 1.518/2009 e fixa o vencimento base para os cargos de procuradores, de provimento efetivo e privativos de advogados, criados pela Lei Municipal n° 1.475/2007 e dá outras providências."
1614,2011,"Dispõe sobre a criação de Funções Gratificadas: FGS-01 e FGS-02, no âmbito da Estrutura Organizacional da Câmara Municipal do Ipojuca."
1615,2011,"Altera altera o att 2° da lei municipal n° 1.459/2007, que institui o auxílio-alimentação no âmbito da câmara municipal do ipojuca e dá outras providências."
1616,2011,Dispõe dispõe sobre a revisão do plano plurianual do município do ipojuca 2010-2013 para o exercício de 2011 e dá outras providências.
1617,2011,?
